电影名,用户昵称,评论内容,评论日期,点赞数,星级数
我不是药神,大奇特(Grinch),改编自著名的陆勇案，医改前国人对医药问题的漠视，合理求生欲在法律面前的抗争。在还原了事件原型之余，加入了群戏和戏剧张力，落脚于伦理与法律的博弈。尽管弱化了诉讼的过程，但已经构成了对生命的敬畏。黄毛彭浩是宁浩致敬自己《疯狂的赛车》的黄毛耿浩吗？,2018/6/19,135,40
我不是药神,朝阳区陆依萍,全方位通俗且教科书，符合主流国内观众观影水准式的改编，这样的题材和最后的呈现能做到这样，非常值得尊敬，但整体艺术水准不如《嘉年华》！,2018/7/1,148,30
我不是药神,Jasmine,这个片子如果给自己的定位是一部传记片，一些问题是可以接受的，但它明显不是传记片，作为剧情片来说，那些问题就真是问题了，比方说打女人这个初始人设。还有很多地方给人感觉用力过猛。前半段剧情拼命赶，你仿佛能看到一个计划表，要在几分几秒完成什么任务，后半段又有些黏糊。然后片方当初宣传公关的所谓关注现实题材的点，其实也都用力过猛甚至夸张到让我反感的地步了，所以我坚决没去影院直到现在才看。在我的标准它是个7分的片子，对国产片宽容，四舍五入鼓励性打四星。,2018/11/17,0,40
我不是药神,猛汉世雄,真是一部让人痛苦的电影，看得人不想说话，只想流泪。,2018/7/6,118,50
我不是药神,寒枝雀静,C/本质是回避体制分析的个人英雄主义抒情，但又可通过全球化对位来映射分化的国内阶层。与其说是对商业道德的歌颂不如说是一次对市场和调控都完全无法拯救的社会绝境乐观且粗糙的描绘。大资本与律法的刻画都还是太程式化，光靠正面力量的情感支撑显然不够。越到后半程剧作推着走的痕迹就越重。,2018/7/3,86,40
我不是药神,水怪,这样难得有态度、立场、尊严的电影，是需要有观众情绪足够的累积呼应，才能产生完整能量核的。这甚至与票房无关，票房只是结果。韩国的社运片可以屡破纪录，中国观众没有理由比他们差。,2018/6/30,191,50
我不是药神,fateface,有人说冲着敢拍这个社会题材就要好评。我觉得是很纯熟的商业片模式，该哭的地方哭，并没有意外。最后剧情失控了，往假大空的路上越走越远……,2018/7/9,66,40
我不是药神,W小姐（吴桐）,国产片的闪光之作，当然现实生活依然很残酷。里面最不舒服的地方就是药贩徐峥洗手不干的时候，白血病人对他的道德绑架。如果不是为了赚钱，帮忙搞到药是情份，不帮是本分，干嘛一个两个都好像欠了他们一样。你要死了，就无所谓也搭进去别人的人生？所以全程无泪点，结尾有小感动。徐峥戏真是好。,2018/7/7,102,40
我不是药神,陆支羽,3.5。1.笑中带泪，敢拍这题材的确是填补空缺了；文牧野导演不负众望，而徐峥的演技同样经得起考验。2.确实没必要以《达拉斯买家俱乐部》来衡量本片，各有各的活法。,2018/6/20,87,40
我不是药神,咱说,我们终于成功学会了韩国某种现实题材类型片讲故事的方式。这个反映现实的片子好看，却又并没有触及什么现实。它给徐峥、周一围包括牧师所设定的若干道德两难命题，流于表面，并不复杂和纠结，至少没揪起我作为一个观众的心。中国观众需要《药神》这样好看的电影，但这样的电影绝不能止于好看而已。【华纳永润】,2018/7/8,69,40
我不是药神,犹在镜中,改编改变了主人公身份，加了戏剧冲突，以此升华主角使其变得崇高，体现情理和法理的二律背反主题。可毛病不少：脱口罩礼赞加夹道欢送，这是什么待遇？有造神嫌疑；特写多，摇镜粗暴，艺术性差，由此剧情显得非常扎眼，易被认为在绑架观众。但演员出色，感情细腻，加上题材缘故，还是给个中评吧。,2018/7/1,87,30
我不是药神,Neroat,看的点映，是好电影，感觉是中国版的达拉斯买家俱乐部。开篇宁浩徐峥的名字配上印度神曲让我以为是喜剧，后来发现是社会现实题材，在完全没有心理建设的情况下好几次被触动得眼眶发红。演员表现都很不错。后期一直在思考，法律和道德哪里才是平衡点呢？,2018/7/4,164,40
我不是药神,方洛洛,能在大屏幕上看到这种题材的中国电影，本身就是一种进步。,2018/7/4,148,50
我不是药神,叶阿福,社会主义初级阶段的电影电影院里男女老少的啜泣声，一结束就马上跑出来的我表示十！分！恐！怖！1星原因实在是困惑为什么这么多5星？,2018/7/5,108,10
我不是药神,mumudancing,好看的电影无非三种：极爽，极美，极有共鸣。人人都怕老病死，人人都怕上下为难的中年，人人都有为谋生计不得不做的事情，人人亦都向往真与善……是这些时刻集中起来让煽情的中年油腻英雄不那么脱离现实。瑕不掩瑜，从长远来看，也许它是一部可以和《熔炉》相提并论的电影。,2018/7/4,105,40
我不是药神,萨库拉,戏里戏外，每一层文本都很中国。中国式现实主义其实是个童话，中国人世世代代都需要假想的侠，中国人有了钱就有了尊严可以砸人跳脱衣舞，中国电影的逻辑置换绕太多弯外国人大概看不懂，所以这个片子在中国取得巨大成功并没有什么好奇怪的，它迎合的是每个中国人的X点。,2018/7/7,71,30
我不是药神,每日可爱二百人,当然不能跟影史上那些堪称伟大的纪实电影相比，也不能用过高的艺术标准去衡量它。硬去推敲细节的话，是有粗糙和漏洞的，煽情也过度了些。但作为商业片，在中国这样的审查制度下，拍到这个程度已经很好了。学不了美国，学学韩国印度，用电影揭露和改变社会，最好；暂时改变不了，能引起重视也是好的呀。,2018/7/6,95,40
我不是药神,Ada Wang,对结局稍有失望和遗憾，如果导演在男主被关押上车后街上病人行注目礼黑屏戛然而止显然会更加真实，更加引人深思。只可惜后面又多了几秒呵呵，有时候，我们需要等待社会进步，福利越来越好，但是有些生命已经等不起了，这个残酷的问题丢给了观众，我渴望着一个答案。优秀的反思现实的国产片但是分数虚高,2018/7/4,90,40
我不是药神,肖浑,徐峥从小人物到救世主被拔得有点太急太高了，最后煽情让我憋眼泪憋得头疼，有几个场面过于戏剧化，不过都可以理解，依然值得鼓励。,2018/7/6,87,40
我不是药神,袁长庚,需要多少滑稽和猥琐才能讲一个高尚的故事，需要多少眼泪和亲情的糖衣才能吐一口反对的唾沫，需要多少条命多少升血才能论证救赎的必要意义？别问我对这个电影的看法，这特么哪是电影能聊的出来的？,2018/7/9,68,40
我不是药神,欢乐分裂,3.5；题材制胜，不无煽情仍是动人，“长的是磨难短的是人生”贫穷是无法医治的病，资本社会里情义无法开出希望的空头支票，底层蝼蚁的微茫呐喊虽无异于蚍蜉撼树，但透过这微光或许还有挣扎的可能；从浑噩到清醒，并无神祇降临，唯有自救自渡，尺度拿捏准确，戏剧层面的现实视野，太需要这样的国产片。,2018/7/1,74,40
我不是药神,妖灵妖,非寻常视野里的上海,2018/6/30,65,40
我不是药神,美神经,完全没想到这么好看，哭了。,2018/7/4,128,50
我不是药神,刘康康,可以说达到了韩国社会问题片的水准，与其跟《达拉斯买家俱乐部》对比，倒不如跟《辩护人》、《熔炉》对比，相似点更多。当然也有韩国电影一样用力过猛、煽情太过的毛病，比如最后病人自发来到马路边送行。但整体还是让人惊喜，希望这样的电影越来越多。,2018/7/1,79,40
我不是药神,白眉道长,光是挑战这种题材的勇气，就值得打五星,2018/7/3,126,50
我不是药神,黑凤梨,非常催泪的电影，很久没有看过这样好好讲故事的国产现实题材电影了。“他们只想活着，有什么错呢”，被徐峥、章宇、王传君、杨新鸣、谭卓和老奶奶感动得一塌糊涂。,2018/7/4,165,50
我不是药神,眠去,我更喜欢原型故事。,2018/7/5,65,30
我不是药神,Vamei,把一点恻隐之心，都留给这部电影。,2018/7/3,103,50
我不是药神,红豆?,永远治不好的穷病,2018/7/4,95,50
我不是药神,弹球小姐Lydia,没想到啊你个春光灿烂猪八戒，有两把刷子啊,2018/7/3,119,40
我不是药神,霡霂,电影很好看，节奏也很好，演员也很好，但是看完电影发现遭了一张罚单，嗯，一星,2018/6/30,27,10
我不是药神,猪大勇,几处过度的感情渲染和最后字幕、车里对话所显示的“求生欲”，并不妨碍这部电影的优秀。要放在一水国产电影里评价的话，光取材就可以打满星。,2018/7/7,71,40
我不是药神,尽欢,我承认，我犯法了，无论怎么判决，我没有异议。我只希望，未来这个社会可以变的更好一点。,2018/7/1,190,50
我不是药神,盒饭,一部能让中国电影人挺起腰杆的电影。推荐每位学法律的同仁都去看看，对我们的职业一定会有更丰富深刻的理解。,2018/7/1,92,50
我不是药神,路西法尔,国产电影阉掉的结尾多少分都扣没了。在各方力量挤压下批判现实主义在当代已经完了，能指与所指脱节后迎来的是幻象批判主义。在影片里到处都是无意识：赚一笔就离开这里，一定把孩子送到国外，有了钱生命仍然欠缺意义……实际上把所有可能走过一遍之后，会发现唯一有效的路一开始已经摆在那了：去上访。,2018/7/7,51,30
我不是药神,杨大志°,根据现实事件改编，一部非常具有现实意义的电影。如果有机会，谁会不想活下去。演员的演技都挺在线的，哭戏和情绪爆发的戏份很有感染力。这部电影让我知道了一个不曾了解过的群体，也让我看到了一些进步，不仅仅是电影。,2018/7/4,100,40
我不是药神,小镇中年高Mars,先让你轻易感动得稀里哗啦，再让你觉得连救命药0关税都是恩赐是及时雨#宣宣水准与时俱进# #朝中有人好拍电影#,2018/7/4,81,20
我不是药神,Wendy,徐峥要横扫影帝大奖。,2018/7/1,126,50
我不是药神,王写写,3.5，上海买家俱乐部。整体还不错，前半段展开分寸拿捏的可以，后面过度煽情了，几乎五六分钟就要来一段情感宣泄，用台词对主题的不断强调也显得重复。最后十里长街送药神的配乐也太主旋律了。感觉作者后面没沉住气，急切地想把所有话都说出来。,2018/6/27,62,30
我不是药神,法兰西胶片,三星半。娴熟，融洽，也触碰到最后那道坎，很满足了。另外我必须复制粘贴一下我在《辩护人》短评里写的内容：在济州岛的第二天，包了个车，和韩国司机导游表达了2013年整个韩国电影对中国影迷的影响，他很不可思议：“真的这样吗？哦，很有意思。”,2018/6/19,58,40
我不是药神,土呆,我就问药企的研发费用谁买单？市场经济这么多年了，商人还是地主周扒皮嘴脸，都晓得吃饭不能搞人民公社大锅饭，吃药就一定要全民AA？谁不同情病人，谁不担心自己没有药，谁不渴望延续生命？但不代表这病人所得到的救赎就真的那么理所应当。,2018/7/9,67,30
我不是药神,百里即墨殇,上周末看的电影，开头一段印度咖喱曲想起，就很嗨想抖腿，笑点自然也算密集，情节铺开对我来说比较自然，后半段哭了但不是很夸张的哭，就很自然的想落泪～我很喜欢这种现实题材，但感觉好像大陆较少，徐峥稳～周一围帅～王传君颠覆～黄毛血性～教父搞笑～酒吧经理骚！！！,2018/7/4,138,50
我不是药神,维城乱马,在此之前，我们只有改变电影的国家；在此之后，也许我们也可以有改变国家的电影。希望这一天早点到来。,2018/7/7,73,40
我不是药神,金正峰江湖骗子,达拉斯粉激情打分~,2018/7/4,109,50
我不是药神,FloriaZENG,说实话，九分真的过高了，但无可否认这部电影有他的感染力和闪光点，题材的意义和演员的魅力简直太大了，好几处让人无法不为之动容。尽管在节奏和部分剧情处理上还是有些不自然和过分煽情，但终究是值得令人尊重的国产片。对于那些说其媚俗的人，我替演员和背后的工作人员感到难过。,2018/7/7,67,40
我不是药神,魏晓波,可能人们离现实太远了，看到一个和现实稍微沾点边的电影就全民狂欢了。。这就是一个普通的商业电影，病态的电影市场,2018/7/12,54,30
我不是药神,太常寺协律郎,好。但是从2002到2018，又是多少生命和家庭。,2018/7/7,79,50
我不是药神,? 狐不悔，,“他有什么罪啊，他只是想活而已！”很难的，能在国内影院看见这类片的上映。感恩，祝福。,2018/7/4,91,50
我不是药神,巴伐利亞酒神,几乎零差错的优秀商业电影，完全符合一部出色商业片的所有布局。徐峥奉献了一次能拿奖到手软的表演，几个配角的塑造的也相当成功，有血有肉，煽情也恰到好处。开头便直接用字幕告诉你取材于真实事件，加之病魔缠身后那种无力又痛楚的压迫感，真的很容易让观众产生同理心，所以电影口碑爆棚也不奇怪。,2018/7/4,82,40
我不是药神,Eco,这种电影，给个五星容易，给三星很难。,2018/7/4,64,30
我不是药神,内陆飞鱼,佩服，中国现实主义题材拍摄方式的一种样板，影像，故事，节奏，表演皆纯熟到位，悲而不哀，怨而不愤，尺度掌握好，结尾有些那个，但好像也没有更好办法了，自私懦弱的平民百姓，几乎成为救民于水火的“超级英雄”，这是最发人深省的地方，宁浩、徐峥提携新导演，提携很到位，预感徐峥要拿表演奖啦。,2018/6/30,53,40
我不是药神,ChrisKirk,看到两股势力的交锋，却没看到锋芒下的冒险精神，题材本身所具有的深度在迫击炮般的泪点轰击下被冲淡不少，更何况此中个人神化的倾向性太过乖张，虽能一语中的指出诟病所在，但这样的蜻蜓点水无论从哪个角度看都像极一场模式化的兜售，权衡和融合后本质也仍是求稳心理，但这不能怪创作者，大环境如此。,2018/7/3,63,30
我不是药神,五,不喜欢后半截。啥时才可以别为理所应当的事情歌功颂德、痛哭流涕？啥时候才可以别要求别人具备社会身份（本片中是商人）以上的道德？啥时候才可以别牺牲了无数人，才给自己一句“时代进步总有代价、知错能改就是好的”？,,49,
我不是药神,Y.Phoenix,实属国产佳作，但不至于被捧上神坛。富有争议的题材，出色的表演，真实事件改编，可惜不能还原幕后真实利益关系，迫于需要过审，只能脸谱化谄媚处理，后半段煽情技法非常奏效，但缺乏电影的高级感。这样的题材可以过审，而且排片可以像商业大片一样如此密集，实属不易。,2018/7/7,66,40
我不是药神,托尼·王大拿,有些地方的那群众呼声，不还是早年间献礼片那一套？但带着镣铐起舞的技法成熟度体现在文本和影像上，尤其剪辑，虽不大胆，但看的舒心，节奏感特顺溜。,2018/7/5,47,40
我不是药神,皮革业,不管到底出于什么原因，对题材边界的突破都值得肯定。另外，怎么都那么把打分当回事啊，还最终评分7.3、7.4的，想当高考阅卷老师还是体操裁判啊……,2018/7/5,49,40
我不是药神,安德烈大叔,《达拉斯》混《辛德勒》，国内少有的现实主义题材佳作，难能可贵为弱势群体发声。剧作标准朴素，具有一定批判性的同时也找到了尺度上的分寸，在伦理道德与社会制度的冲突之间传递人性之善，不仅对电影产业有益，也具备社会关怀的价值，当下环境太缺这种作品了。四星水准，再送上创作者的一星鼓励。,2018/7/4,72,50
我不是药神,那个男人,徐峥渐渐宋康昊化了，照这个趋势，影帝是跑不了的。恭喜徐峥。不过，制药公司定这么高的价格，真没毛病，药物的研发成本极高，如果不保护产权帮助制药公司收回成本。那请问，新的药谁去研发？医药行业还要不要进步？,2018/7/4,128,50
我不是药神,汪金卫,电影将“陆勇案”进行了戏剧化改编，把主角的身份由病人改编成商人（这一改编对整个故事架构、人物设定造成很大影响），并以男女老青各种阶级身份的病人、家属作为配角，展现了病人弱势群体众生相。将大医药厂商代表立为反派（迎合国情？）。在中国电影创作环境下，本片确实为难得的关注现实题材的力作。编、导、演整体不错，但也不够突出，仍有不少套路与瑕疵。不时出现的喜剧元素减少了苦难煽情成分，但也削弱了稳重的现实风格。警察角色不够立体，其表达出的善意缺乏动机。结尾为过审而“正能量”的风格也让人遗憾。演员表演和剧本的深度、完成度与《达拉斯买家俱乐部》以及诸多韩片现实题材电影相比尚有差距。值得鼓励，但不值得过誉,2018/7/1,68,30
我不是药神,麻友安,从摄影机调度上可以看出导演是具备电影语言自觉性的（这在国产商业片中实属罕见），可惜那些低俗、谄媚的类型化桥段使影片割裂开来，破坏了本应建立的现实深度，而趋于造作的虚假。同时，这种类型化的改编策略导致一种二元对立的思维导向，并不利于反思事件本身，因此所谓的社会意义本身也沦为虚假。,2018/7/5,47,20
我不是药神,柏林苍穹下,“有一种病你救不了，就是穷病。” —— 底层立场的非典型国产片，而且还有几秒钟触碰到问题的实质。,2018/7/7,51,50
我不是药神,纤纤,看完电影出了影院，马上给在保险公司的朋友去了电话，第一次主动想为自己多备点安全感。,2018/7/4,82,40
我不是药神,TuTu兔,谁标记的达拉斯啊？这是真实事件改编的，分的清哪个在前哪个是在后吗？还有个别品味高贵冷艳还要diss他人观影口味的，黑也要有点水准吧，我们那场实打实的抽泣声一片，要讨厌请代表你个人，别弄得好像爱看的人才是另类。,2018/7/4,127,50
我不是药神,bekey,看了点映，也看了好多评论，真的是很激动也很幸运能和很多人一起有同感想要点赞，能看到这么好的电影，真的是各位老师们的共同努力！徐峥、王传君还有周一围，演技真的杠杠的，一下将人拉进去剧情中！！！期待上映后的再度光临~,2018/7/1,152,50
我不是药神,远子,已经很不错了。现实肯定比电影复杂，之前看过的一些根据真人真事改编的电影，其现实往往比电影表现的要黑暗得多（比如《无人知晓》）。但我想我们不能因为现实的复杂而去否定电影的“单纯”。从某种程度上讲，这也是电影存在的意义。这部电影能够激发大家关于进口药的讨论，也是好事。,2018/7/9,47,40
我不是药神,女神的秋裤,有故事，有技术，有意义，这特马才叫电影，一部能把人看哭的喜剧电影。前半段绝壁是宁浩指导！……还有，做坏事会下地狱的！,2018/6/30,85,50
我不是药神,胡弃暗,谭卓有点郝蕾的意思。,2018/7/5,66,30
我不是药神,赫恩曼尼,第一次看点映，非常震撼的好片子！国产电影终于也可以不逃避现实问题了，情节、转折、人物处理得都非常到位！徐峥演技炸裂，几个配角闪闪发光。等上映之后可以二刷！,2018/7/1,70,50
我不是药神,梅山君,里面好几个片段让人动容落泪，大概感同身受都是因为活在中国，体会过看病难看病贵看病苦这些状况，都是想努力活下去的人，有什么罪吗？,2018/7/4,71,50
我不是药神,Paco,哭且服了。都在纠结批判得对不对，“现实”掺了多少假，偏偏忘了首先作为电影，它拍得好。伪现实和小批判有主客观因素引致，但是毛病就是毛病，不管从哪来，都在扣掉的一星里了。可没关系，它根本的价值既不在于现实意义，也不需要籍此加冕，而是关于如何去定义一个好人，和善良的意义——这是最大的意义。→12.1二刷。,2018/7/11,39,40
我不是药神,张春[阿卡纳],热评导致没哭的我感觉自己是不是反社会…,2018/7/8,49,40
我不是药神,你写论文了嘛,看的点映。面对法理与情理之间的冲突。药贩程勇给出了自己的答案，警察曹斌给出了自己的答案，众多白血病患者也给出了自己的答案。虽然这部电影不像《素媛》和《熔炉》那样推动了法律的改革。但是用电影记录下我国在医疗改革的过程中发生的故事也是有意义的。,2018/6/30,111,50
我不是药神,心生,四星半。讲的是过去的故事，但当然也会是一种投射，一种聚焦。在过去的影像时空里，角色讲着相信会更好，会让人下意识地立即着眼于另一个时空，相同的地域，不同的时间，类似的困苦、愤恨与折磨。但终究，还是要相信会更好吧。最终当然是要回归的，但前面完成的表达已经足够。,2018/7/6,31,50
我不是药神,恶魔的步调,韩式思路印式煽情的本土化达拉斯买家俱乐部,2018/7/1,33,40
我不是药神,肖恩恩恩恩肖,好看的部分，太久没看到这种真实了！生活环境是真实的，情绪是真实的，困境也是真实的，甚至女主角是一个真实的上了年纪的美女，有真实的皱纹！真实才能带来沉浸体验。不好看的部分，就是唯一看出人工痕迹的地方，道德审判太明显，限制了更多的角度。,2018/7/3,57,40
我不是药神,二十二岛主,上影节第14场。没有那么好，但作为新锐导演处女作足够扎实锋利，对于现实的刻画以及医药制度的批判，能够过审本身就已很了不起，在有限的话语环境内也做到了最好的表达，尤其是徐峥谭卓王传君三位的表演，为这个故事大大增色。部分场景有借鉴韩影的色彩，希望以后拍类型片散伙饭部分不要再吃火锅了。,2018/6/19,45,40
我不是药神,tata,可能煽情部分对大多数老百姓来说，是做的很到位，我这种身经百战的豆瓣er可不吃这套??，片子不坏，题材好，值得看看，三星半吧。媒体吹的上天，也有点滑鸡,2018/7/4,67,30
我不是药神,Fenng,一个印度宝莱坞式的精彩故事，折射中国社会的残酷现实。,2018/7/3,56,50
我不是药神,冷杉,从印度药神，中国药神，最后上映成了我不是药神，悲剧改喜剧。导演镜头设计有很多瑕疵，但精准戳中了社会情绪点，预计票房50亿。医疗、警察、海关系统，全都黑了一遍。没有版权意识的观众很容易接受这种思想：你花十几亿美元研发灵药仍然是奸商，我不努力挣钱不买保险不锻炼身体得病就应该吃到药。,2018/7/7,49,30
我不是药神,揪住你的小尾巴,想对勇哥说，你就是药神。,2018/7/7,60,50
我不是药神,Summer,印度仿制药是拿印度患者做实验的，根本不考虑人权，全世界盗版侵权都被诟病，不知道为啥印度仿制药这样就被赞扬。短时间内这种便宜药可能对部分患者有益，长时间来说这种情况泛滥以后就没有公司愿意研发新药了，现在很多便宜的好药已经没有厂家生产了，没有利润，厂家也要发工资吃饭。,2018/7/4,74,30
我不是药神,室内滂沱,前半部分固然好的很，但两种味儿的冰激凌既然不能分着卖，也只能看成整体了。后半集简直是卫生部版的战狼2，听说过杰克苏玛丽苏，没想到又冒出一个圣人苏，节奏、剪辑、镜头、表演甚至是配乐，都比前面差了不知多远，一下子打回主旋律原型。合着这事儿还是发生在qq年代，敢把时间背景放到现在吗,2018/7/11,42,20
我不是药神,瑾朵朵,【没钱】比【有病】更可怕,2018/7/6,39,40
我不是药神,沈入忘??,太值得哭了，我从刚开始看到病人用一麻袋的零钱买药那个镜头就开始想哭，差不多哭到结束。尽管我知道有些镜头是故意煽情，但我还是整个哭到头疼。过程中最大的感受不是觉得主角伟大，也不是因为最后这个药有了好的进展，而是觉得人要好好活着真的太不容易了。希望每个人都健康快乐，好好活着。,2018/7/1,62,50
我不是药神,飞天羽痕,演的扎实，拍的用心，很不错的国产类型片。前半部分比较爽快，后面有点墨迹，有煽情嫌疑，但不让人反感，本来就是个感人的故事，人间少有的真情在。,2018/11/19,0,40
