电影名,用户昵称,评论内容,评论日期,点赞数,星级数
我不是药神,泡椒凤爪,力荐!绝对值得一看的好片子。探讨人性与社会。观影的过程会因为幽默而大笑，但是心中始终感觉到那些底层人的悲伤。很喜欢的几个人物意料之中的死去了，法与情冲突起来有时让人绝望，好在结局让我看到了希望。,2018/7/4,98,50
我不是药神,时间之葬,从主题上讲，勇气可嘉，比绝症更令人绝望的，是利益操持下的强权制度。从手法上讲，这大概就是那种很多人希望国内能拍出来的“改变现实的电影”。,2018/6/18,43,40
我不是药神,桜の花飞舞时,个人今年最佳国产，要刷很多遍。,2018/7/5,92,50
我不是药神,李濛Lemon,片中的角色都面临法律与良知相悖的困境，而编剧也一直在故事深度与能否过审的两难中纠结。前半段黑色幽默，的确有《达拉斯买家俱乐部》的气质，后半段升华得有点过，滥煽情，但被演员的好演技平衡掉了。几乎所有角色的演技都值得吹上一波，徐峥和周一围少许的对手戏相当精彩。,2018/6/18,44,50
我不是药神,Sophie  Z,在印度，烟雾中遇到神像那段非常地神来之笔了。然后就是一边感觉结尾的升华煽情有点太过，一边看到路边人群中吕受益和黄毛摘下口罩的脸就想哭。,2018/7/9,30,40
我不是药神,圆首的秘书,真的不错哦，直到结尾都不错，个人愿意再看一遍。但实话讲，并不觉得这是中国电影的进步，也不是什么制度的进步，至多是化用其他电影创意的方式的进步。其中比较露骨没藏好的地方，比如结尾对辩护人毫无节制的“索取”，让人瞬间失去共情的动力。中国缺故事吗？显然不缺，但始终还是缺一点“大聪明”。,2018/7/5,41,40
我不是药神,三坨土,看完原型人物陆勇当年的报道，其中一句话又让我想哭。曾受益于代购药的病患帮陆勇求情，在电话里用颤音说：「我的生活低下一点不要紧，我不是要生活得很好很好，我是要求生。」我没有直面过疾病，但我通过电影所感受到的绝望已经让我无法承受了，虽然这种隔着屏幕的同感可能只是真实世界的十分之一,2018/7/5,61,50
我不是药神,梅花牛,剧情紧凑、信息量大。能过审也是挺神奇的。好多年没看过这么酣畅淋漓的国产片儿了。,2018/7/6,64,50
我不是药神,大头绿豆,题材3分，前半部分3分，后半部分1分，结尾0分。高分说明讲好一个故事在现在的院线已经是多么难得的事，以及，不能把讲不圆一个好故事的锅都甩给广电总局。结尾可以好很多的。,2018/7/10,32,30
我不是药神,陆冠均,这几年有那么多正面导向的新闻报道，希望大家去关注医改药改、关注伤残病弱群体，其实都不如这样一部脍炙人口的电影来得更有效果。《我不是药神》的成功，算是偶然中的必然。,2018/7/5,47,50
我不是药神,麻绳,应该是2018年最爆炸的话题电影。直面中国底层生命的苦难和尊严，也没有逃避对社会制度和商业法则的拷问，在当下的中国电影中十分难得。创作上很成熟，剧作和表演尤其出色，每个人物都很立体，性格逻辑都很扎实，徐峥表演的突破性很大。事实证明，只要有生存空间，中国也能拍出《辩护人》那样的电影,2018/6/21,42,50
我不是药神,H.K.X.L,和谐版的《辛德勒的名单》。,2018/7/5,49,10
我不是药神,饥饿艺术家,最初打动我的是「弟妹」，那一口闷，很绝。中间打动我的也是「弟妹」，破衣烂衫不算刻意。除了周一围很帅，后面没人打动我。弟妹这个角色，让我想起《星际穿越》里那个死守的弟弟，整件事似乎和他无关，可又是这无关人员，最撩动心弦。BTW，什么时候心理咨询纳入医保？至少Co-pay？,2018/7/7,42,40
我不是药神,烟波人长安,“他只是想活着，他有什么罪？”,2018/7/14,36,50
我不是药神,维舟,过誉了。本以为可能是中国版的《达拉斯买家俱乐部》，最后发现倒不如说是在向《辛德勒的名单》致敬。,2018/7/8,33,40
我不是药神,文刀大土申,一部各方面都非常成熟的商业片，尺度拿捏适中，煽情却不过度贩卖。作为一部处女作作品，出人意料，当然这离开不宁浩、徐峥两位老司机监制的把关。再者，触碰如此大胆的现实主义题材，过审已属不易，从之前的更改片名便能看出，它之于国产电影创作的意义不可忽视，应当支持。,2018/7/1,39,40
我不是药神,竺.不二.哼哼,建议各党政机关，企事业单位，社会团体组织观看。,2018/7/5,55,50
我不是药神,诸葛若见,比《达拉斯买家俱乐部》更让人感动一些，真实代入感太强了。黄毛像随处可见的村镇青年，却有着难得的江湖气。程勇则由猥琐奸商，逐渐成长为大侠。众生皆苦，不是药神是凡人。,2018/7/2,36,40
我不是药神,两江狐子,善良是一种选择。题材难得，成功造神，真实事件作嫁衣，换个名目也成立。人物特点突出但落不下去，患病停药有什么后果，何以至此？一概不知。狂欢似的拔地而起，现实一敲打就退缩。前一半飘，后一半煽。仅以法大于情、求生无罪拷问现实，很弱。意不在关怀，而在巨婴社会做好人难。演技合格。好项目。,2018/7/3,44,30
我不是药神,陈长鬙,前一个多小时好看，闹假药会场的段落很精彩，虽然很多段落都很典型、缺少新意，但拍得很好看。后面三十分钟有点崩，情绪收不住，破碎成一片鸡汤。看到qq群放大“希望”二字时感觉和前面不是同一部电影。,2018/7/14,32,40
我不是药神,陈哈,简单地把锅甩给医药公司有点太表面化了，当然也是没办法，总不能甩给那谁吧，电影本身拍得不是特别精彩但也都在线，但总得来说是良心诚意之作，之前老看韩国，美国片说这些，国内终于也有了，这个高分也是正常的，观众实在是憋坏了。尽管如此，这事还是得说【我去年的画《药不能停》和《我不是药神》海报这事怎么弄，我没有一个迟斌啊！》】：https://www.douban.com/note/682266397/ 《关于艺术：元素，借鉴，创作，再创作，涉嫌抄袭》：https://mp.weixin.qq.com/s?__biz=MzA5MjM0MjcyMQ==&tempkey=OTY1X0t0RXVhQkZRdUpzaTJSOEhWT1F5ZGZRYUViVjI3SHFtc0x3bm1wTm80NjllY0FNNG5COUcxLU0wUTB0TDd4c,2018/7/14,36,40
我不是药神,老袁,好,2018/7/6,36,40
我不是药神,张大水,摄影有几场戏挺喜欢，大排档火和烟作为前景的戏，葬礼后徐峥主视角穿过人群的戏。,2018/7/7,44,40
我不是药神,支离疏,确实很不错，四星水准，鼓励一星。,2018/7/1,35,50
我不是药神,nothing纳森,社会上只有一种病就是穷,2018/6/30,46,30
我不是药神,Iosefka,药企耗费大量资金的自研成果救人无数，在电影里成了恶意兜售高价药的黑心反派，盗版药商摇身一变为救世主，就好比义正言辞“盗版的不要钱，为什么要去买正版？” 在版权意识薄弱的这片土地，这个议题如此处理实在不妥。,2018/7/5,40,40
我不是药神,kulilin,题材过审不易，煽情肯定削弱了力量。宁浩本来要导的,2018/6/27,44,30
我不是药神,脑子进水,什么是恶？恶意引导群众就是恶！进口药贵是外商的锅吗？,2018/7/5,49,30
我不是药神,邻居山田,专访过导演，可能也就大我两三岁，比片中“小黄毛”章宇还小3岁。才能突出到可以弥补学历经验，哪怕一辈子就这一部片子也不算白来。演员也都太对了，怎么能全都演得那么好呢。看片时左右哭得快背过去了，人是会恻隐的啊。那我觉得它存在的意义就是给毫无尊严的吾等屁民一根火柴。希望它得一些奖。,2018/6/25,45,50
我不是药神,你大豪爷,徐峥说上海话好可爱哈哈,2018/7/8,38,40
我不是药神,周眠,完成度很高，的故事会。“通篇的煽情都很克制”，不如说“通篇都在很克制地煽情”。局限眼光，不令有智，为了什么行为背书，一目了然。如此推衍，雨燕也可以拍我不是车神。另有一波不是书神，碟神，不是陆客大巴神，不是地沟油食神在路上。,2018/7/6,23,40
我不是药神,李九弟Jody.L,“我相信未来会好起来。希望这一天，早点来吧。”我们终于有了为之骄傲的电影。离开的人们，现在2018年了，看看这个世界吧。,2018/7/6,45,50
我不是药神,罗四夕,看的今天的点映场，题材很深刻，很有现实意义，演员们表现都很不错，徐峥的表演起码值一个三金影帝吧,2018/7/1,71,50
我不是药神,美卡 mecca,7/5@明珠光大 两星半。话题性优势，但糟烂喜剧套路与媚俗的演绎方式几乎毁了现实主义向打开的任何可能。现场所有笑点都几乎哑掉，后半段走稳但蓄势不足至于最后煽情环节也毫无感觉。总之一句话，还是国产片不自信+资本傲慢表现，虚肿但爆款。ps 俩男主油得能去炸鸡柳 pps 题材再好和呈现面貌应是乘法而非加法关系,2018/7/5,35,20
我不是药神,说的就是你,很有意义的一部电影??,2018/7/4,66,50
我不是药神,水浒三国金刚,中国电影的水平，中国足球是追不上的,2018/7/6,30,40
我不是药神,香茹,问题已经解决了再拿来拍，就不具备引起反思或推动社会进步的功能了，像歌功颂德(非自愿)，矛盾的视野也不全面，瑞士药商被塑造成唯利是图的形象不能令人满意。抛开剧本本身的剧情张力，电影在表达上也只能说不功不过。情绪上还是挺煽的，设置太多笑点像有强迫症。,2018/7/3,27,40
我不是药神,野子,故事虽然显得有点老套，但是几个主演真的很棒，题材也很走心，至少值得尊敬。,2018/7/3,51,40
我不是药神,今夕何夕,2018年至今最佳电影，没有之一！从老奶奶对警察说“药假不假难道我们不知道吗”开始哭到最后，就像电影里说的，最大的病是穷病，没法治。希望通过这部电影反应出的问题能引起相关部门的重视，也希望国产片中能出现越来越多反映现实题材的佳作。,2018/7/4,80,50
我不是药神,怀璧不予,大哭一场，还能说什么呢，愿生命漫长夜短暂。,2018/7/13,42,50
我不是药神,麻辣香水鱼,这几天网络口碑一直发酵，迫不及待抽空去看了，不仅仅是本身演技和剧情的质量过硬，在真实事件基础上的改编，整部电影的立意和想法都给人触动非常深刻，前半段笑点很有梗，后半段连我在内的好多人都哭得不行……不剧透不无脑吹，希望大家都能去看看这部良心电影，真的值得。,2018/7/4,52,50
我不是药神,恶魔奶爸Sam,中国网民得有多天真多傻逼才认为药企不容易，我不是药神对药企的刻画太妖魔化太偏颇了。什么样的人会说出这种话，是谁出钱买通了大V说这种话，这种话对谁有好处。不言而喻,2018/7/29,28,50
我不是药神,Pukii,好看！真的好看！虽然导演的节奏有点商业，不够个性，但基本上完成度有九成了。看得挺想哭的。。。很多问题，没有答案。为什么没有答案？对不起，这也没有答案。。。,2018/7/3,58,50
我不是药神,57,看得我大哭一场。这只能说明导演很会煽情，而且真是学到了好莱坞精于算计那一套，敏锐地抓到一个（过时的）现实题材，毫不手软地捞一笔。当然眼泪不全是被动的，看到故事背景里那么多无处伸张的社会不公，非常痛切地意识到指望一部电影或者一个被编剧塑造的良心发现的商人来改变一切，是多么的轻易和可笑。,2018/7/19,22,20
我不是药神,昏金暗玉,它并非天才般横空出世的电影，也不走让你眼前一亮的设计，但在小人物通往“圣人”的设计上，在每场戏的功能上都计算精准，其实它有非常巧妙的不为人察觉的价值偷换，内核与幕后黑手的转移也有点移花接木的意思。但处女作选择不玩形式感不玩概念的现实主义题材并能流畅呈现已是沙漠开出的花。,2018/7/4,29,40
我不是药神,硬邦邦帮主胡子,这样内容能上映就很难得。我们总说韩国电影敢拍，敢揭露。这部电影某种程度上在中国电影史上关于这一作用将来也会留下位置。其中关于公安蛮横检查小店，翻开的商品乱扔，最后只有一句面无表情的谢谢配合这样的小细节，很真实。表达的很好。在中国生活过，你就太知道这部片子想讲的不仅仅是药了。,2018/7/11,32,50
我不是药神,大海里的针,徐峥宁浩又一次高水准发挥：幽默、现实、残酷、感动，比纯喜剧更具现实意义。最喜欢假药贩子的那句台词：这世上只有一种病——穷病。,2018/6/18,37,50
我不是药神,爱电影,不错的电影，很感人呀！催人泪下，呜呜呜呜呜呜呜呜呜呜呜呜呜呜呜呜呜呜呜呜呜呜呜呜呜呜呜呜呜呜呜呜呜呜呜呜呜！,2018/7/4,36,10
我不是药神,邓若虚,棒。在这样的环境下也已经做到了足够赤裸裸，起码戳到了一些真正的痛点。就按照这个路子多来几部吧，现实和真相的面纱早就需要揭开了。,2018/7/7,34,50
我不是药神,三点水木木木,真的太惊喜太惊喜了，感动又深刻。徐峥演技爆表，期待他得奖！！！！！！！啊啊啊，刚看完点映我还是有点激动,2018/6/30,54,50
我不是药神,鹿菏,是我在电影院看过观影体验最好的一部电影，那么多人没有人看手机没有吃爆米花的声音整个影厅安静无声，看完心里很堵不知道说什么，就如同我也无法理解为什么一只羊死了能上热搜而昨天贫困山区小孩去垃圾山找玩具却被掩埋致死的热搜很快就没了，难道穷真的是原罪吗？！,2018/7/13,38,50
我不是药神,力娃,挺好看，演的厉害，拍的聪明，也跟着度过了一段哭哭笑笑的时光。弱与用力过猛的地方、PPT式煽情的地方，作为消费者，觉得可以理解，乐意支持，也愿意推荐给更多人。两星扣给作为观众的这届年轻人。从什么时候，看电影要比拍电影更用力了？,2018/7/5,45,30
我不是药神,池子,第一次这么不理性的打分，没看几分钟就走了，有王传君我真的看不下去，恶心,2018/7/5,16,10
我不是药神,掉线,大大超出预期，故事的确像《达拉斯买家俱乐部》，但整体气质更像《辩护人》之类的韩国电影，更类型化，简化了一些构建，提高了娱乐性和可看戏，预感上映后口碑爆炸,2018/6/19,23,40
我不是药神,思郁,刚看完点映场，这里面的黑色幽默需要返观现实才能体会到小人物的蝼蚁般的悲凉，作为电影来说，还是煽情了些。不敢苛责电影人，国产电影能做到这个程度已经很好了。,2018/6/30,28,40
我不是药神,无耻不混蛋,想赋予人物灵魂，你得先有灵魂。想赋予电影“心”，你得先有“心”。这部电影最出色的地方，就在于它在处理现实主义题材中各种的平衡性与分寸感，以及“天生的黑色幽默”。它恰到好处的用一个带传奇色彩的“真实故事”，表达了当下中国底层生存所遭遇的“两大悖论”：病人的悖论以及穷人的悖论。,2018/7/4,31,50
我不是药神,小辣椒,看的点映，今年国产最佳无疑了！我们太需要这样的电影了，故事情怀道理深刻都有，徐峥和王传君会拿奖吧！,2018/6/30,69,50
我不是药神,阿德,看了二遍，还是最欣赏王传君的表演，每个眼神和动作都太到位了，然后就是影片整体的节奏和可看性，太超出预期了，目前为止今年的华语片最佳。,2018/6/19,45,50
我不是药神,猪老三,中国电影就像关在笼中的困兽，还有巨大巨大超级超级的空间,2018/7/18,22,40
我不是药神,啊啊啊,槽你码！打三星以下的都装你码什么比呢？,2018/7/4,62,50
我不是药神,H2O.,哭了大半场。。。,2018/7/1,42,50
我不是药神,穿裤子的云,拍电影不就是讲故事吗，故事讲的好就是好电影，而不是把宝都压在流量明星的身上。所以希望这部电影可以成为中国票房最高的电影，有越来越多的好剧本，好演员能跑出来,2018/7/5,37,50
我不是药神,三七莲华,虽然仍有稚嫩之处但煽情也太到位了，出来眼睛是红的，主要演员都演得很好，最好是好在难得没有分正邪好坏，故事讲顺了，作为导演处女作真的厉害。,2018/7/6,37,50
我不是药神,猴头虫,这个题材在国内很少见，但真心拍得很用心，每个人物的蜕变刻画入骨三分。片尾结束后，居然现场自发鼓掌超过1分钟，真的很感人。,2018/6/22,34,50
我不是药神,人五,好好看啊，吹爆这部戏！,2018/7/7,37,50
我不是药神,曼仔,至少前四分之三都是好看的，到结尾有点强行升华了，病人送徐峥入狱简直有如十里长街送总理。。。但是整体的剧本和表演都相当可以。徐峥王传君和刘牧师都真好啊，周一围很克制，对他的好感有回来一点儿，谭卓太多镜头简直就是当年的郝蕾啊。。。,2018/7/6,36,40
我不是药神,我要加油,剧情特别搞笑，而且特别接地气，把现实生活中的都呈现出来,2018/7/4,64,40
我不是药神,好姑娘老妖,很棒！还是有很多人是真的热爱电影的！,2018/7/4,32,50
我不是药神,·金鱼酱·,余生漫长除了生死再无大事，我会一直陪着你走到最后的。老公别怕！,2018/7/8,36,50
我不是药神,大瘦瘦,2016年药神在hkiff拿了创投大奖，当晚朋友拉着和文牧野一起吃饭，对方斯文儒雅低调不像一般人在饭桌上就开始油腻胡喷了，对他印象颇佳。另外关于这片我想说，不要用达拉斯买家俱乐部或者韩国电影去做类比，于人于己都是毫无意义之事，我喜欢谭卓和王传君的表演，大象席地而坐的章宇更是优秀,2018/6/19,26,40
我不是药神,石破天,感叹于这部片子揭示的买药贵买药难问题，很棒的片子，后半段剧情急转十分催泪，很真实。,2018/7/1,56,50
我不是药神,我是尾号2473,穷病固然难治，可问题是大家为什么穷？人病了要吃药，社会病了吃什么？,2018/7/3,25,40
我不是药神,鬼腳七,毛病当然还是存在，包括非常商业套路的煽情方式和妥协。但是吧，这种片子，有就比没有强，方向是好的，要鼓励。,2018/7/4,28,40
我不是药神,阿丽丝,用徐峥惊人溢出式的演技港一句“天啊怎么会有这么媚俗的套路”，整个片子分裂得很怪异，前半段依然刹不住车的“囧式”路数，后半段混杂了努力想要达成的现实主义和煽情套路，总之令人非常难过，反感的那种。黄毛火锅那段戏倒是有些意外动人。说国版达拉斯那个自己真的不尴尬么？就，祝票房大卖吧。,2018/7/1,54,20
我不是药神,twotwo,“他才20岁，他有什么罪！”“我只是想活着，我有什么罪！”,2018/7/8,28,50
我不是药神,雨谷,新世代的年青导演们值得期待。,2018/7/6,36,50
我不是药神,魏小河,值得高分,2018/7/5,27,40
我不是药神,桃子,比起《达拉斯》矛头直指FDA，这部依然是中国特色巨婴逻辑:我穷我病我有理；成本、风险，我不负；你放弃，你混蛋 /这故事，只要能顺利拍下来，谁都能火，没有一个值得称赞的镜头和调度，全凭剧本、表演和音乐煽情，这导演也是运气真好。例如：原型最讨厌的千里相送，只要做个变焦，就不是夸张而是隐喻,2018/7/8,23,30
我不是药神,橘生淮南,真的很好看！关注我们身边最关键的医疗，赚了我半场的眼泪！力荐！,2018/7/4,63,50
我不是药神,迷特波鲁,想多加很多星。拍的好、演的好、立意好、结局也很好。大笑与大哭，法和情都对的时候，该怎么选啊！哭唧唧，要是在家里看，肯定泪奔到核桃眼了…推荐推荐！！,2018/7/3,43,50
我不是药神,獨孤島主,精彩时代与缄口不言虚实相济共同构成大于叙事本身的丰富张力,2018/6/20,18,40
我不是药神,子文东,《暴裂无声》之后今年又一部关于现实的国产好电影，有一点苦涩的幽默，更多的普通人在利与义、法与情之间的挣扎，即使毫无悬念，这样的故事一步一步讲出来，最后还是会让人无法控制情绪……因为这里面其实到最后也没有什么英雄义士，只是人本着基本的良知就必然走到这一步，而这样的事不会只有这一件…,2018/7/1,30,50
我不是药神,zhanhei,仿佛是能处理社会题材的韩国商业片了  真的不容易 不要苛求了   舞女谭卓对着男服务生含泪大喊“脱”的那一幕印象太深刻,2018/7/6,27,40
我不是药神,心理咨询师卢悦,所有给差评的人，没有看到这部电影是在什么样的土壤中长出来的，一棵松树在平地上没什么了不起，了不起的是黄山松，在有限的土壤中在岩石中长出来！,2018/7/5,46,50
我不是药神,老醜殘??,生在此界，能活下去就是最大的勇氣和奇蹟，以一人之力扮演救世主來對抗整個體系的無能和殘忍，最後字幕中挽尊儼然黑色幽默。最讓人動容的不是他如何救贖，而在於他如何猶豫和掙扎，終究人性還是有善。with@bitch_wangfree at北碚萬達,2018/7/6,24,50
我不是药神,Morning,这部电影有真正的困境，所以才能带来真正的思考，是一部熔炉之作。在文本上解构了英雄，将故事讲得鞭辟入里，而社会类话题的影片背后更是没有精致的利己主义，可以感受到文牧野导演的慈悲心。它是珍贵的电影。,2018/6/19,27,40
我不是药神,蔡要要不吃药,活着可真的很好很好,2018/7/8,27,40
我不是药神,朱老板,想说的很多，就不说了吧。各个方面都很好。,2018/7/7,32,50
我不是药神,darkcat,绝对是今年国产电影的最佳，应该没有之一了！,2018/6/30,25,40
我不是药神,毒妇脸少女心。,五星太高了 剧本是好剧本 后半部分剧情和人物转换太TM突兀了吧 而且我居然没哭（但是徐峥演技值得满分了开头在想上海话太标准了结果立刻百度结果发现他就是上海人啊哈哈哈我的诡异笑点？）,2018/7/6,28,30
我不是药神,夜第七章,在西湖文化广场看完电影后，发现又把雨伞丢了。看的时候想起了《达拉斯买家俱乐部》，没有太被抗争所感动，反倒最触及我的是生死。想起小时候记住的苏轼的诗：“惟愿孩儿愚且鲁，无灾无难到公卿。”生死面前从来都不曾有无神论者的。生命太脆弱，愿每个人都平安喜乐，在尘埃里开出花：）,2018/7/3,38,40
我不是药神,傻冒叔,很值得去影院看的国产片。注重观影体验的娱乐性和思考现实问题的艺术性算是融合得很好了，虽然结尾太伟光正，煽情有点用力稍猛，依然瑕不掩瑜吧。几位主角集体贡献了好演出，徐铮和王传君估计明年冲各种男主，周一围很帅谭卓很美，杨新鸣也太像金士杰了。。。,2018/7/8,26,40
我不是药神,齐木楠雄,非常现实的题材，到后面全场都在擦眼泪，每一个人都演技在线，片尾字幕看到瑞士格列宁在我国已经进入医保，慢粒白血病人存活率从02的30%增加到85%，真的太好了,2018/7/6,40,50
我不是药神,喵锅先森Danbo,阿姨哭着说不想死想活的时候，我也哭了。,2018/7/8,30,50
我不是药神,祁十一,朋友圈里一片好评，也确实是近年国产佳作，这样的现实题材拍成电影、故事性还如此强、如此动人就很难得。但又总觉得缺了点什么，从艺术角度来说是少了回味感。所有打动我的电影，都是回味无穷的，但它缺少。原因？当然因为审查，真正的现实顽疾、根子，根本无法表现。所以只能避重就轻。,2018/7/3,47,40
我不是药神,橙曦羽潞,终于有时间去看了，吹爆剧情，真实故事改编的现实题材果然能够发人深省！电影里每个细节都值得推敲，每个人物都有自己的魅力！老奶奶的“我想活着”真的催泪！徐峥是意料之中的好，王传君是惊喜！,2018/7/6,36,50
我不是药神,JulyChan,一个自私的小人物被硬生生逼成了济世的英雄，都是因为世道太艰难，有尊严地活着太难了。第一次感受到国产电影中的“真实”是有力量的。一次成功的共情体验，分分钟就觉得自己会成为电影中的那个人。,2018/7/1,24,50
我不是药神,似水年华,由真实故事改编的电影，演员演技在线，笑中带哭，发人深省，非常值得一看。,2018/7/2,78,50
我不是药神,西帕克,对韩国电影和《达拉斯买家俱乐部》现学现卖，非常模版化，也非常有效。戳中了观众的某些痛点，但改编的程度过大，反而隐藏了真正的现实。如同《辛德勒的名单》里撒出的是水而不是毒气，这类题材在造神的同时，也背负了粉饰历史的原罪。,2018/7/1,23,30
